{
  "episode_id": "EP001",
  "card_id": "MTT-FL-EP001-SUPPLY",
  "slug": "supply",
  "category": "供需與價格",
  "card_type": "concept",
  "title_zh": "供給",
  "title_en": "Supply",
  "definition_zh": "正式定義待匯入。",
  "example_zh": "正式生活例子待匯入。",
  "challenge": null,
  "front_image": null,
  "back_image": null,
  "release_date": null,
  "status": "demo"
}
